<?xml version="1.0" encoding="UTF-8" standalone="yes"?>
<KitData xmlns:xsi="http://www.w3.org/2001/XMLSchema-instance" xsi:noNamespaceSchemaLocation="MarkerSet.xsd">
  <Version>2.0</Version>
  <Kits>
    <Set>
      <Name>LaneStandardOnly_3</Name>
      <LadderFree>true</LadderFree>
      <NChannels>3</NChannels>
      <ILS>
		<AllLaneStandards>true</AllLaneStandards>
        <ChannelNo>3</ChannelNo>
      </ILS>
      <FileNameSuffix>LANESTANDARDONLY3</FileNameSuffix>
      <GenotypeSuffix>LANESTANDARDONLY3</GenotypeSuffix>
      <DirectorySearchString>LANESTANDARDONLY3</DirectorySearchString>
      <FsaChannelMap>
        <Channel>
          <KitChannelNumber>1</KitChannelNumber>
          <fsaChannelNumber>1</fsaChannelNumber>
          <Color>BLUE</Color>
          <DyeName>6-FAM</DyeName>
        </Channel>
        <Channel>
          <KitChannelNumber>2</KitChannelNumber>
          <fsaChannelNumber>2</fsaChannelNumber>
          <Color>GREEN</Color>
          <DyeName>VIC</DyeName>
        </Channel>
        <Channel>
          <KitChannelNumber>3</KitChannelNumber>
          <fsaChannelNumber>4</fsaChannelNumber>
          <Color>ORANGE</Color>
          <DyeName>LIZ</DyeName>
        </Channel>
      </FsaChannelMap>
      <Locus>
        <Name>Channel1</Name>
        <Channel>1</Channel>
        <MinBP>1</MinBP>
        <MaxBP>400</MaxBP>
        <MinGridLSBasePair>60.0</MinGridLSBasePair>
        <MaxGridLSBasePair>1200.0</MaxGridLSBasePair>
        <LadderAlleles>
          <Allele>
            <Name>11</Name>
            <CurveNo>9</CurveNo>
            <BP>156</BP>
            <RelativeHeight>MH</RelativeHeight>
          </Allele>
          <Allele>
            <Name>12</Name>
            <CurveNo>10</CurveNo>
            <BP>160</BP>
            <RelativeHeight>MH</RelativeHeight>
          </Allele>
        </LadderAlleles>
      </Locus>
      <Locus>
        <Name>Channel2</Name>
        <Channel>2</Channel>
        <MinBP>1</MinBP>
        <MaxBP>400</MaxBP>
        <MinGridLSBasePair>60.0</MinGridLSBasePair>
        <MaxGridLSBasePair>1200.0</MaxGridLSBasePair>
        <LadderAlleles>
          <Allele>
            <Name>11</Name>
            <CurveNo>9</CurveNo>
            <BP>156</BP>
            <RelativeHeight>MH</RelativeHeight>
          </Allele>
          <Allele>
            <Name>12</Name>
            <CurveNo>10</CurveNo>
            <BP>160</BP>
            <RelativeHeight>MH</RelativeHeight>
          </Allele>
        </LadderAlleles>
      </Locus>
    </Set>
  </Kits>
</KitData>
