<?xml version="1.0" encoding="UTF-8"?>
<KitData xmlns:xsi="http://www.w3.org/2001/XMLSchema-instance" xsi:noNamespaceSchemaLocation="MarkerSet.xsd">
	<Version>2.0</Version>
	<Kits>
		<Set>
			<Name>Cannabis</Name>
			<NChannels>2</NChannels>
			<ILS>
			<LS>
				<LSName>ABI-ROX500</LSName>
			</LS>
				<ChannelNo>2</ChannelNo>
			</ILS>
			<FileNameSuffix>cannabis</FileNameSuffix>
			<GenotypeSuffix>cannabis</GenotypeSuffix>
			<DirectorySearchString>cannabis</DirectorySearchString>
			<FsaChannelMap>
				<Channel>
					<KitChannelNumber>1</KitChannelNumber>
					<fsaChannelNumber>3</fsaChannelNumber>
					<Color>YELLOW</Color>
					<DyeName>NED</DyeName>
				</Channel>
				<Channel>
					<KitChannelNumber>2</KitChannelNumber>
					<fsaChannelNumber>4</fsaChannelNumber>
					<Color>RED</Color>
					<DyeName>ROX</DyeName>
				</Channel>
			</FsaChannelMap>
			<Locus>
				<Name>NMI01</Name>
				<Channel>1</Channel>
				<MinBP>122</MinBP>
				<MaxBP>356</MaxBP>
				<MinGridLSBasePair>123.</MinGridLSBasePair>
				<MaxGridLSBasePair>344.</MaxGridLSBasePair>
				<CoreRepeatNumber>6</CoreRepeatNumber>
				<LadderAlleles>
					<Allele>
						<Name>2</Name>
						<CurveNo>10</CurveNo>
						<BP>128</BP>
					</Allele>
					<Allele>
						<Name>16.1</Name>
						<CurveNo>15</CurveNo>
						<BP>213</BP>
					</Allele>
					<Allele>
						<Name>22.1</Name>
						<CurveNo>20</CurveNo>
						<BP>249</BP>
					</Allele>
					<Allele>
						<Name>23</Name>
						<CurveNo>25</CurveNo>
						<BP>254</BP>
					</Allele>
					<Allele>
						<Name>26</Name>
						<CurveNo>30</CurveNo>
						<BP>272</BP>
					</Allele>
					<Allele>
						<Name>28</Name>
						<CurveNo>35</CurveNo>
						<BP>284</BP>
					</Allele>
					<Allele>
						<Name>30.1</Name>
						<CurveNo>40</CurveNo>
						<BP>297</BP>
					</Allele>
				</LadderAlleles>
			</Locus>
		</Set>
	</Kits>
</KitData>