<?xml version="1.0" encoding="UTF-8"?>
<KitData xmlns:xsi="http://www.w3.org/2001/XMLSchema-instance"
	xsi:noNamespaceSchemaLocation="MarkerSet.xsd">
	<Version>2.0</Version>
	<Kits>
		<Set>
			<Name>NIDDKFragileX1</Name>
			<NChannels>2</NChannels>
			<LS>
				<LSName>ABI-LIZ1200</LSName>
				<LSName>ABI-LIZ-60-1200</LSName>
				<LSName>ABI-LIZ-100-1200</LSName>
				<LSName>ABI-LIZ-120-1200</LSName>
				<ChannelNo>2</ChannelNo>
			</LS>
			<FileNameSuffix>NFX1</FileNameSuffix>
			<GenotypeSuffix>NFX1</GenotypeSuffix>
			<DirectorySearchString>NFX1</DirectorySearchString>
			<FsaChannelMap>
				<Channel>
					<KitChannelNumber>1</KitChannelNumber>
					<fsaChannelNumber>1</fsaChannelNumber>
				</Channel>
				<Channel>
					<KitChannelNumber>2</KitChannelNumber>
					<fsaChannelNumber>5</fsaChannelNumber>
				</Channel>
			</FsaChannelMap>
			<AllOLAllelesAccepted>true</AllOLAllelesAccepted>
			<Locus>
				<Name>Left</Name>
				<Channel>1</Channel>
				<MinBP>100</MinBP>
				<MaxBP>295</MaxBP>
				<MinGridLSBasePair>146.4</MinGridLSBasePair>
				<MaxGridLSBasePair>232.0</MaxGridLSBasePair>
				<CoreRepeatNumber>3</CoreRepeatNumber>
				<MaxExpectedAlleles>12</MaxExpectedAlleles>
				<MinExpectedAlleles>1</MinExpectedAlleles>
				<LadderAlleles>
					<Allele>
						<Name>30</Name>
						<CurveNo>2</CurveNo>
						<BP>140</BP>
						<RelativeHeight>H</RelativeHeight>
					</Allele>					
					<Allele>
						<Name>31</Name>
						<CurveNo>3</CurveNo>
						<BP>143</BP>
						<RelativeHeight>H</RelativeHeight>
					</Allele>
					<Allele>
						<Name>32</Name>
						<CurveNo>4</CurveNo>
						<BP>146</BP>
						<RelativeHeight>MH</RelativeHeight>
					</Allele>
					<Allele>
						<Name>41</Name>
						<CurveNo>5</CurveNo>
						<BP>170</BP>
						<RelativeHeight>H</RelativeHeight>
					</Allele>
					<Allele>
						<Name>42</Name>
						<CurveNo>6</CurveNo>
						<BP>173</BP>
						<RelativeHeight>H</RelativeHeight>
					</Allele>
					<Allele>
						<Name>43</Name>
						<CurveNo>7</CurveNo>
						<BP>176</BP>
						<RelativeHeight>H</RelativeHeight>
					</Allele>
					<Allele>
						<Name>48</Name>
						<CurveNo>8</CurveNo>
						<BP>188</BP>
						<RelativeHeight>M</RelativeHeight>
					</Allele>
					<Allele>
						<Name>49</Name>
						<CurveNo>9</CurveNo>
						<BP>191</BP>
						<RelativeHeight>M</RelativeHeight>
					</Allele>
					<Allele>
						<Name>50</Name>
						<CurveNo>10</CurveNo>
						<BP>194</BP>
						<RelativeHeight>M</RelativeHeight>
					</Allele>
					<Allele>
						<Name>55</Name>
						<CurveNo>11</CurveNo>
						<BP>206</BP>
						<RelativeHeight>M</RelativeHeight>
					</Allele>
					<Allele>
						<Name>56</Name>
						<CurveNo>12</CurveNo>
						<BP>209</BP>
						<RelativeHeight>MH</RelativeHeight>
					</Allele>
					<Allele>
						<Name>57</Name>
						<CurveNo>13</CurveNo>
						<BP>212</BP>
						<RelativeHeight>M</RelativeHeight>
					</Allele>
					<Allele>
						<Name>58</Name>
						<CurveNo>14</CurveNo>
						<BP>215</BP>
						<RelativeHeight>MH</RelativeHeight>
					</Allele>
				</LadderAlleles>
			</Locus>
			<Locus>
				<Name>Right</Name>
				<Channel>1</Channel>
				<MinBP>293</MinBP>
				<MaxBP>900</MaxBP>
				<MinGridLSBasePair>515.0</MinGridLSBasePair>
				<MaxGridLSBasePair>539.0</MaxGridLSBasePair>
				<CoreRepeatNumber>3</CoreRepeatNumber>
				<MaxExpectedAlleles>12</MaxExpectedAlleles>
				<MinExpectedAlleles>1</MinExpectedAlleles>
				<LadderAlleles>
					<Allele>
						<Name>156</Name>
						<CurveNo>3</CurveNo>
						<BP>516</BP>
						<RelativeHeight>H</RelativeHeight>
					</Allele>
					<Allele>
						<Name>157</Name>
						<CurveNo>4</CurveNo>
						<BP>519</BP>
						<RelativeHeight>MH</RelativeHeight>
					</Allele>
					<Allele>
						<Name>158</Name>
						<CurveNo>5</CurveNo>
						<BP>522</BP>
						<RelativeHeight>H</RelativeHeight>
					</Allele>
					<Allele>
						<Name>159</Name>
						<CurveNo>6</CurveNo>
						<BP>525</BP>
						<RelativeHeight>H</RelativeHeight>
					</Allele>
					<Allele>
						<Name>160</Name>
						<CurveNo>7</CurveNo>
						<BP>528</BP>
						<RelativeHeight>M</RelativeHeight>
					</Allele>
					<Allele>
						<Name>161</Name>
						<CurveNo>8</CurveNo>
						<BP>531</BP>
						<RelativeHeight>M</RelativeHeight>
					</Allele>
					<Allele>
						<Name>162</Name>
						<CurveNo>9</CurveNo>
						<BP>534</BP>
						<RelativeHeight>M</RelativeHeight>
					</Allele>
					<Allele>
						<Name>163</Name>
						<CurveNo>10</CurveNo>
						<BP>537</BP>
						<RelativeHeight>MH</RelativeHeight>
					</Allele>
				</LadderAlleles>
			</Locus>
		</Set>
	</Kits>
</KitData>
